[
  {
    "id": "2.1",
    "slug": "poor-school-performance",
    "title": "Poor School Performance",
    "presenting": "Poor school performance",
    "group": "neurodevelopmental",
    "overview": "Poor academic performance is common and nonspecific. Most childhood mental disorders can impair it, and it is frequently the chief complaint — but it is not itself a disorder. Evaluation typically pairs cognitive/achievement testing with a careful history from parents, teachers, and clinicians. Because neurodevelopmental and other disorders often co-occur, traverse the tree more than once and assign every applicable diagnosis.",
    "start": "n1",
    "nodes": [
      { "id": "n1", "question": "Are there deficits in intellectual function plus deficits in adaptive functioning, with onset during the developmental period?", "yes": { "outcome": "Intellectual Disability (Intellectual Developmental Disorder)", "diagnoses": [{ "name": "Intellectual Disability", "table": "3.1.1" }] }, "no": { "goto": "n2" } },
      { "id": "n2", "question": "Are there deficits in the social use of verbal and nonverbal communication?", "note": "If accompanied by restricted/repetitive behavior and deficits in relationships and social-emotional reciprocity, consider Autism Spectrum Disorder; otherwise Social (Pragmatic) Communication Disorder.", "yes": { "goto": "n2a" }, "no": { "goto": "n3" } },
      { "id": "n2a", "question": "Are there also restricted, repetitive patterns of behavior/interests and deficits in developing/understanding relationships?", "yes": { "outcome": "Autism Spectrum Disorder", "diagnoses": [{ "name": "Autism Spectrum Disorder", "table": "3.1.3" }] }, "no": { "outcome": "Social (Pragmatic) Communication Disorder", "diagnoses": [{ "name": "Social (Pragmatic) Communication Disorder", "table": "3.1.2" }] } },
      { "id": "n3", "question": "Is there difficulty learning and using specific academic skills (reading, writing, mathematics)?", "yes": { "outcome": "Specific Learning Disorder", "diagnoses": [{ "name": "Specific Learning Disorder", "table": "3.1.5" }] }, "no": { "goto": "n4" } },
      { "id": "n4", "question": "Are there persistent difficulties in the acquisition and use of language?", "yes": { "outcome": "Language Disorder", "diagnoses": [{ "name": "Language Disorder", "table": "3.1.2" }] }, "no": { "goto": "n5" } },
      { "id": "n5", "question": "Is there failure to speak in school despite speaking in other settings (e.g., home)?", "yes": { "outcome": "Selective Mutism", "diagnoses": [{ "name": "Selective Mutism", "table": "3.5.2" }] }, "no": { "goto": "n6" } },
      { "id": "n6", "question": "Are there symptoms of inattention and/or hyperactivity-impulsivity, onset before age 12, interfering with functioning across settings?", "yes": { "outcome": "Attention-Deficit/Hyperactivity Disorder", "diagnoses": [{ "name": "Attention-Deficit/Hyperactivity Disorder", "table": "3.1.4" }] }, "no": { "goto": "n7" } },
      { "id": "n7", "question": "Is there a pattern of severe temper outbursts out of proportion to the situation with persistent anger/irritability between outbursts?", "yes": { "outcome": "Disruptive Mood Dysregulation Disorder", "diagnoses": [{ "name": "Disruptive Mood Dysregulation Disorder", "table": "3.4.4" }] }, "no": { "goto": "n8" } },
      { "id": "n8", "question": "Is there a pattern of antisocial behavior (e.g., truancy, rule violations)?", "yes": { "outcome": "Conduct Disorder", "diagnoses": [{ "name": "Conduct Disorder", "table": "3.14.3" }] }, "no": { "goto": "n9" } },
      { "id": "n9", "question": "Is there a pattern of negativistic, hostile, and defiant behavior?", "yes": { "outcome": "Oppositional Defiant Disorder", "diagnoses": [{ "name": "Oppositional Defiant Disorder", "table": "3.14.1" }] }, "no": { "goto": "n10" } },
      { "id": "n10", "question": "Is the poor performance related to excessive substance use?", "yes": { "outcome": "Substance Use Disorder", "diagnoses": [{ "name": "Substance Use Disorder", "table": "3.15.1", "seeTree": "2.26" }] }, "no": { "goto": "n11" } },
      { "id": "n11", "question": "Is there school refusal based on fear of separation from attachment figures?", "yes": { "outcome": "Separation Anxiety Disorder", "diagnoses": [{ "name": "Separation Anxiety Disorder", "table": "3.5.1" }] }, "no": { "goto": "n12" } },
      { "id": "n12", "question": "Is another anxiety, mood, or psychotic disorder interfering with school performance?", "yes": { "outcome": "Indicate the specific disorder", "kind": "refer", "diagnoses": [{ "name": "Schizophrenia", "table": "3.2.1" }, { "name": "Major Depressive Disorder", "table": "3.4.1" }] }, "no": { "goto": "n13" } },
      { "id": "n13", "question": "Is it a maladaptive response to an identifiable psychosocial stressor?", "yes": { "outcome": "Adjustment Disorder", "diagnoses": [{ "name": "Adjustment Disorder", "table": "3.7.2" }] }, "no": { "outcome": "Not attributable to a mental disorder (e.g., poor work habits, disruptive environment, lack of motivation)", "kind": "no-disorder" } }
    ]
  },
  {
    "id": "2.2",
    "slug": "behavioral-problems-child-adolescent",
    "title": "Behavioral Problems in a Child or Adolescent",
    "presenting": "Behavioral problems in a child or adolescent",
    "group": "neurodevelopmental",
    "overview": "Many behavioral problems in youth are not due to a mental disorder — some are subthreshold, some reflect family dysfunction, and some serious acts (e.g., for financial gain) fall outside DSM-5. Early-childhood onset points toward ADHD, ODD, DMDD, ASD, or intellectual disability; adolescent onset raises the role of substances and adolescent-onset conduct disorder, mood disorders, and psychosis.",
    "start": "n1",
    "nodes": [
      { "id": "n1", "question": "Are the behaviors associated with substance use (including medication)?", "yes": { "outcome": "Substance-related etiology", "diagnoses": [{ "name": "Substance/Medication-Induced Disorder, Intoxication, or Withdrawal", "seeTree": "2.26" }, { "name": "Substance Use Disorder", "table": "3.15.1" }] }, "no": { "goto": "n2" } },
      { "id": "n2", "question": "Are they due to the physiological effects of a general medical condition?", "yes": { "outcome": "Medical etiology", "diagnoses": [{ "name": "Delirium Due to Another Medical Condition", "table": "3.16.1" }, { "name": "Major/Mild Neurocognitive Disorder, with Behavioral Disturbance", "table": "3.16.2" }, { "name": "Personality Change Due to Another Medical Condition", "table": "3.17.11" }] }, "no": { "goto": "n3" } },
      { "id": "n3", "question": "Do severe temper outbursts occur that are grossly out of proportion, with persistent anger/irritability between them?", "yes": { "outcome": "Disruptive Mood Dysregulation Disorder", "diagnoses": [{ "name": "Disruptive Mood Dysregulation Disorder", "table": "3.4.4" }] }, "no": { "goto": "n4" } },
      { "id": "n4", "question": "Is there a persistent pattern of hyperactivity, impulsivity, and inattention across two or more settings with onset before age 12?", "yes": { "outcome": "Attention-Deficit/Hyperactivity Disorder", "diagnoses": [{ "name": "Attention-Deficit/Hyperactivity Disorder", "table": "3.1.4" }] }, "no": { "goto": "n5" } },
      { "id": "n5", "question": "Is there a pattern of argumentativeness, defiance, and vindictiveness beyond developmental norms?", "yes": { "outcome": "Oppositional Defiant Disorder", "diagnoses": [{ "name": "Oppositional Defiant Disorder", "table": "3.14.1" }] }, "no": { "goto": "n6" } },
      { "id": "n6", "question": "Do the behaviors occur with intellectual and adaptive deficits with onset in the developmental period?", "yes": { "outcome": "Intellectual Disability", "diagnoses": [{ "name": "Intellectual Disability", "table": "3.1.1" }] }, "no": { "goto": "n7" } },
      { "id": "n7", "question": "Do they occur with persistent deficits in social communication/interaction plus restricted, repetitive behaviors?", "yes": { "outcome": "Autism Spectrum Disorder", "diagnoses": [{ "name": "Autism Spectrum Disorder", "table": "3.1.3" }] }, "no": { "goto": "n8" } },
      { "id": "n8", "question": "Are they a consequence of stereotyped, repetitive motor movements?", "yes": { "outcome": "Stereotypic Movement Disorder", "diagnoses": [{ "name": "Stereotypic Movement Disorder" }] }, "no": { "goto": "n9" } },
      { "id": "n9", "question": "Are they part of a repetitive, persistent pattern of antisocial behavior violating others' rights or major norms?", "yes": { "outcome": "Conduct Disorder", "diagnoses": [{ "name": "Conduct Disorder", "table": "3.14.3" }] }, "no": { "goto": "n10" } },
      { "id": "n10", "question": "Is there deliberate, purposeful fire setting associated with arousal/fascination?", "yes": { "outcome": "Pyromania", "diagnoses": [{ "name": "Pyromania" }] }, "no": { "goto": "n11" } },
      { "id": "n11", "question": "Is there recurrent failure to resist impulses to steal objects not needed for use or monetary value?", "yes": { "outcome": "Kleptomania", "diagnoses": [{ "name": "Kleptomania" }] }, "no": { "goto": "n12" } },
      { "id": "n12", "question": "Are the behaviors associated with periods of elevated, euphoric, or irritable mood plus increased energy?", "yes": { "outcome": "Manic/Hypomanic Episode", "kind": "intermediate", "diagnoses": [{ "name": "Bipolar I Disorder", "table": "3.3.1" }, { "name": "Bipolar II Disorder", "table": "3.3.2" }, { "name": "Cyclothymic Disorder", "table": "3.3.3" }] }, "no": { "goto": "n13" } },
      { "id": "n13", "question": "Are they associated with episodes of depressed/irritable mood plus other depressive symptoms?", "yes": { "outcome": "Major Depressive Episode", "kind": "intermediate", "diagnoses": [{ "name": "Major Depressive Disorder", "table": "3.4.1" }, { "name": "Persistent Depressive Disorder", "table": "3.4.2" }] }, "no": { "goto": "n14" } },